{
  "$schema": "https://json-schema.org/draft/2020-12/schema",
  "title": "CleanYourHarmony acceptance report",
  "type": "object", "additionalProperties": false,
  "required": ["schemaVersion", "title", "generatedAt", "commit", "mode", "status", "summary", "environment", "scope", "limitations", "checks", "nextSteps"],
  "properties": {
    "schemaVersion": {"const": 1},
    "title": {"type": "string", "minLength": 1},
    "generatedAt": {"type": "string", "pattern": "^\\d{4}-\\d{2}-\\d{2}T\\d{2}:\\d{2}:\\d{2}\\+08:00$"},
    "commit": {"type": "string", "pattern": "^([0-9a-f]{40}|N/A：.+)$"},
    "mode": {"enum": ["demo", "actual"]},
    "status": {"enum": ["passed", "partial", "blocked", "not_tested"]},
    "summary": {"type": "string", "minLength": 1},
    "environment": {"type": "string", "minLength": 1},
    "scope": {"type": "array", "minItems": 1, "items": {"type": "string", "minLength": 1}},
    "limitations": {"type": "array", "minItems": 1, "items": {"type": "string", "minLength": 1}},
    "nextSteps": {"type": "array", "items": {"type": "string", "minLength": 1}},
    "checks": {"type": "array", "minItems": 1, "items": {
      "type": "object", "additionalProperties": false,
      "required": ["id", "name", "level", "status", "expected", "observed", "evidence"],
      "properties": {
        "id": {"type": "string", "pattern": "^[A-Z][A-Z0-9_-]*$"},
        "name": {"type": "string", "minLength": 1},
        "level": {"enum": ["build", "install", "launch", "functional", "regression"]},
        "status": {"enum": ["passed", "failed", "blocked", "not_tested"]},
        "expected": {"type": "string", "minLength": 1},
        "observed": {"type": "string", "minLength": 1},
        "evidence": {"type": "array", "items": {"type": "string", "minLength": 1}}
      }
    }}
  }
}
