{
  "schemaVersion": 1,
  "title": "让每一次清爽，都有据可查。",
  "generatedAt": "2026-10-27T12:00:00+08:00",
  "commit": "N/A：模板演示，当前目录不是 Git 仓库",
  "mode": "demo",
  "status": "not_tested",
  "summary": "这是验收报告的结构预览。将目标、实际结果与证据放在一起，让每一项结论都能被复查。以下内容不代表设备上的实际执行结果。",
  "environment": "待填写实际设备型号、系统版本、应用版本与工具链。演示未连接设备。",
  "scope": ["推荐内容：核对目标入口及设置状态", "通知管理：仅验证明确授权的应用", "状态保持：离开页面后重新进入并复查"],
  "limitations": ["演示数据，未执行设备操作。", "启动成功不等于业务验收通过；未覆盖的系统版本不得声明支持。", "未进行重启回归、长期推送观察或性能测量。"],
  "checks": [
    {"id":"HOME", "name":"浏览器首页", "level":"functional", "status":"not_tested", "expected":"目标推荐入口关闭，首页符合预期。", "observed":"等待实际操作及页面复查。", "evidence":[]},
    {"id":"NOTICE", "name":"应用通知", "level":"functional", "status":"not_tested", "expected":"仅指定应用的通知达到授权目标。", "observed":"等待核对应用身份与通知开关。", "evidence":[]},
    {"id":"PERSIST", "name":"设置状态保持", "level":"regression", "status":"not_tested", "expected":"重新进入设置后，目标状态仍然保持。", "observed":"尚未开展回归验证。", "evidence":[]}
  ],
  "nextSteps": ["确认设备和授权范围，逐项记录实际观察。", "保存证据后填写 JSON，通过校验再生成正式报告。"]
}
